{
  "contract_version": "w02-0.1.0-draft",
  "artifact_id": "FACTS-RUN-7539c05cb4fd49aeafd6798be75cd60d",
  "revision": 1,
  "scope_id": "qinghe",
  "origin_run": {
    "run_id": "RUN-7539c05cb4fd49aeafd6798be75cd60d",
    "path": "artifacts/w02/runs/RUN-7539c05cb4fd49aeafd6798be75cd60d/run.json"
  },
  "sources": [
    {
      "meeting_id": "6c1d37b4-9a0c-5106-8e00-9852640f4ea4",
      "file": {
        "path": "artifacts/w02/runs/RUN-7539c05cb4fd49aeafd6798be75cd60d/snapshot/artifacts/w02/sources/W2-interview-6c1d37b4-9a0c-5106-8e00-9852640f4ea4-transcript.json",
        "sha256": "993be8707c253f277289a4011117ecb66e64bac63dad7c8cc60d7af8212cca43"
      }
    },
    {
      "meeting_id": "c4a59a18-4bff-535c-a011-dd0dd0d508fd",
      "file": {
        "path": "artifacts/w02/runs/RUN-7539c05cb4fd49aeafd6798be75cd60d/snapshot/artifacts/w02/sources/W2-interview-c4a59a18-4bff-535c-a011-dd0dd0d508fd-transcript.json",
        "sha256": "02ad528172ab0fbba0d960cddb3c14646c1f351fd780379ca0fd0328ff93ffab"
      }
    },
    {
      "meeting_id": "f97c78e0-6636-5021-9f78-4daba5b3931c",
      "file": {
        "path": "artifacts/w02/runs/RUN-7539c05cb4fd49aeafd6798be75cd60d/snapshot/artifacts/w02/sources/W2-interview-f97c78e0-6636-5021-9f78-4daba5b3931c-transcript.json",
        "sha256": "76ff207e8362bfa12a83331f9ecb8272190d04fb7679a108e7dbe99ac885ce5d"
      }
    }
  ],
  "claims": [
    {
      "id": "CLM-001-0001",
      "statement": "陈姐说，活动到店后她一般先核对三件事：面向哪些会员、哪些门店参与、需要门店做什么，然后再向门店同事说明并确认人员与执行安排。",
      "kind": "fact",
      "evidence_status": "conflicting",
      "qualifiers": [
        "陈姐描述自己的日常做法",
        "“一般”表示通常做法"
      ],
      "evidence": [
        {
          "meeting_id": "6c1d37b4-9a0c-5106-8e00-9852640f4ea4",
          "message_id": "MSG-02603",
          "quote": "活动到店后，我一般先核对三件事：面向哪些会员、哪些门店参与、需要门店做什么，然后再向门店同事说明，确认人员与执行安排。"
        }
      ],
      "conflict_ids": [
        "CONFLICT-001"
      ],
      "review": {
        "status": "pending",
        "note": ""
      }
    },
    {
      "id": "CLM-001-0002",
      "statement": "陈姐说，执行中她会收集顾客问题和门店反馈，有不清楚的找运营核对，结束后整理执行情况。",
      "kind": "fact",
      "evidence_status": "reported",
      "qualifiers": [
        "陈姐描述自己的日常做法"
      ],
      "evidence": [
        {
          "meeting_id": "6c1d37b4-9a0c-5106-8e00-9852640f4ea4",
          "message_id": "MSG-02603",
          "quote": "执行中收集顾客问题和门店反馈，有不清楚的找运营核对，结束后整理执行情况。"
        }
      ],
      "conflict_ids": [],
      "review": {
        "status": "pending",
        "note": ""
      }
    },
    {
      "id": "CLM-001-0003",
      "statement": "最近一次活动的具体情况，以及联系会员、发券这些记录记在哪里、由谁记，陈姐表示不掌握。",
      "kind": "fact",
      "evidence_status": "unknown",
      "qualifiers": [
        "陈姐回答最近一次活动落地情况时表示不掌握"
      ],
      "evidence": [
        {
          "meeting_id": "6c1d37b4-9a0c-5106-8e00-9852640f4ea4",
          "message_id": "MSG-02603",
          "quote": "最近一次的具体情况，以及联系会员、发券这些记录记在哪里、由谁记，我不掌握。"
        }
      ],
      "conflict_ids": [],
      "review": {
        "status": "pending",
        "note": ""
      }
    },
    {
      "id": "CLM-001-0004",
      "statement": "陈姐说，券的发放和核销是两个环节，发放记录不能替代核销记录。",
      "kind": "fact",
      "evidence_status": "reported",
      "qualifiers": [
        "陈姐说具体状态和口径还要核实"
      ],
      "evidence": [
        {
          "meeting_id": "6c1d37b4-9a0c-5106-8e00-9852640f4ea4",
          "message_id": "MSG-02603",
          "quote": "券的发放和核销是两个环节，发放记录不能替代核销记录，具体状态和口径还要核实。"
        }
      ],
      "conflict_ids": [],
      "review": {
        "status": "pending",
        "note": ""
      }
    },
    {
      "id": "CLM-001-0005",
      "statement": "陈姐说，会员拿着线上活动来问门店能否参加时，她会先核对活动适用范围再向会员说明，不会只因为线上看到就认定所有门店都能执行。",
      "kind": "fact",
      "evidence_status": "reported",
      "qualifiers": [
        "陈姐称这是常见场景的说明，不代表已经发生过某次具体事件"
      ],
      "evidence": [
        {
          "meeting_id": "6c1d37b4-9a0c-5106-8e00-9852640f4ea4",
          "message_id": "MSG-02603",
          "quote": "举个例子，会员拿着线上活动来问门店能不能参加，我们会先核对活动适用范围再给会员说明，不能只因为在线上看到了，就认定所有门店都能执行。这是常见场景的说明，不代表已经发生过某次具体事件。"
        }
      ],
      "conflict_ids": [],
      "review": {
        "status": "pending",
        "note": ""
      }
    },
    {
      "id": "CLM-001-0006",
      "statement": "陈姐常要核对的事项包括活动面向哪些会员、哪些门店参与、门店具体要做什么，以及现场顾客的问题由谁答、门店付出的工作怎么记。",
      "kind": "fact",
      "evidence_status": "conflicting",
      "qualifiers": [
        "陈姐说这些不清楚时门店得一边接待一边来回找人问"
      ],
      "evidence": [
        {
          "meeting_id": "6c1d37b4-9a0c-5106-8e00-9852640f4ea4",
          "message_id": "MSG-02605",
          "quote": "常要核对的主要是这几样：活动面向哪些会员、哪些门店参与、门店具体要做什么，还有现场顾客的问题该由谁答、门店付出的工作怎么记。"
        }
      ],
      "conflict_ids": [
        "CONFLICT-001"
      ],
      "review": {
        "status": "pending",
        "note": ""
      }
    },
    {
      "id": "CLM-001-0007",
      "statement": "陈姐认为，线上看到的活动和门店能做的对不上是常见协作场景，需先核对适用范围再跟会员说明，但这不代表已经出过某次具体的事。",
      "kind": "opinion",
      "evidence_status": "reported",
      "qualifiers": [
        "陈姐明确说不是已经出过哪次具体的事"
      ],
      "evidence": [
        {
          "meeting_id": "6c1d37b4-9a0c-5106-8e00-9852640f4ea4",
          "message_id": "MSG-02605",
          "quote": "线上看到的活动和门店能做的对不上，是常见的协作场景，得先核对适用范围再跟会员说明，不能线上看到了就认定所有门店都能执行。不过这不是说已经出过哪次具体的事。"
        }
      ],
      "conflict_ids": [],
      "review": {
        "status": "pending",
        "note": ""
      }
    },
    {
      "id": "CLM-001-0008",
      "statement": "陈姐认为最费力的是活动要求不清楚的时候，希望适用范围、门店要做的事、问题由谁答能先讲明白，少些反复沟通。",
      "kind": "opinion",
      "evidence_status": "reported",
      "qualifiers": [
        "陈姐从门店执行角度提出的期望"
      ],
      "evidence": [
        {
          "meeting_id": "6c1d37b4-9a0c-5106-8e00-9852640f4ea4",
          "message_id": "MSG-02605",
          "quote": "最费力的就是活动要求不清楚的时候，所以我希望适用范围、门店要做的事、问题由谁答能先讲明白，少些反复沟通。"
        }
      ],
      "conflict_ids": [],
      "review": {
        "status": "pending",
        "note": ""
      }
    },
    {
      "id": "CLM-001-0009",
      "statement": "门店平时是否使用会员运营系统、旧智能营销平台门店是否用过及用起来怎么样，陈姐表示都不掌握。",
      "kind": "fact",
      "evidence_status": "unknown",
      "qualifiers": [
        "陈姐说不能替门店说成没用过"
      ],
      "evidence": [
        {
          "meeting_id": "6c1d37b4-9a0c-5106-8e00-9852640f4ea4",
          "message_id": "MSG-02607",
          "quote": "门店平时用不用会员运营系统、之前那个智能营销平台门店有没有用过、用起来怎么样，这些我都不掌握，不能替门店说成没用过。"
        }
      ],
      "conflict_ids": [],
      "review": {
        "status": "pending",
        "note": ""
      }
    },
    {
      "id": "CLM-001-0010",
      "statement": "陈姐表示，系统本身的情况需找 IT 负责人老周核实。",
      "kind": "opinion",
      "evidence_status": "reported",
      "qualifiers": [
        "陈姐在回答门店是否使用会员运营系统、旧智能营销平台是否用过时说的",
        "指向 IT 负责人老周",
        "只涉及系统本身情况"
      ],
      "evidence": [
        {
          "meeting_id": "6c1d37b4-9a0c-5106-8e00-9852640f4ea4",
          "message_id": "MSG-02607",
          "quote": "系统本身的情况，你找 IT 负责人老周核实。"
        }
      ],
      "conflict_ids": [],
      "review": {
        "status": "pending",
        "note": ""
      }
    },
    {
      "id": "CLM-001-0011",
      "statement": "陈姐说她能确认会员复购率已经连续四个季度下滑。",
      "kind": "fact",
      "evidence_status": "reported",
      "qualifiers": [
        "陈姐自称能确认，但具体计算口径仍需项目组核实",
        "自称能确认不等于已核实"
      ],
      "evidence": [
        {
          "meeting_id": "6c1d37b4-9a0c-5106-8e00-9852640f4ea4",
          "message_id": "MSG-02609",
          "quote": "我能确认的是，会员复购率已经连续四个季度下滑，具体怎么算的，还得项目组核实。"
        }
      ],
      "conflict_ids": [],
      "review": {
        "status": "pending",
        "note": ""
      }
    },
    {
      "id": "CLM-001-0012",
      "statement": "陈姐没有给出复购率的具体计算口径，表示具体怎么算还得项目组核实。",
      "kind": "fact",
      "evidence_status": "unknown",
      "qualifiers": [
        "陈姐在回答复购率口径与出处时说的",
        "未给出具体计算口径或出处"
      ],
      "evidence": [
        {
          "meeting_id": "6c1d37b4-9a0c-5106-8e00-9852640f4ea4",
          "message_id": "MSG-02609",
          "quote": "具体怎么算的，还得项目组核实。"
        }
      ],
      "conflict_ids": [],
      "review": {
        "status": "pending",
        "note": ""
      }
    },
    {
      "id": "CLM-001-0013",
      "statement": "陈姐表示，复购率具体怎么算要由项目组核实。",
      "kind": "opinion",
      "evidence_status": "reported",
      "qualifiers": [
        "陈姐在回答复购率口径与出处时说的",
        "指向项目组",
        "陈姐未给出具体口径"
      ],
      "evidence": [
        {
          "meeting_id": "6c1d37b4-9a0c-5106-8e00-9852640f4ea4",
          "message_id": "MSG-02609",
          "quote": "具体怎么算的，还得项目组核实。"
        }
      ],
      "conflict_ids": [],
      "review": {
        "status": "pending",
        "note": ""
      }
    },
    {
      "id": "CLM-001-0014",
      "statement": "老会员回店近一两年有什么变化，陈姐没有能确认的观察依据，不能替门店下结论。",
      "kind": "fact",
      "evidence_status": "unknown",
      "qualifiers": [
        "陈姐回答门店观察时说的"
      ],
      "evidence": [
        {
          "meeting_id": "6c1d37b4-9a0c-5106-8e00-9852640f4ea4",
          "message_id": "MSG-02609",
          "quote": "老会员回店这一两年有什么变化，我手上没有能确认的观察依据，不能替门店下结论。"
        }
      ],
      "conflict_ids": [],
      "review": {
        "status": "pending",
        "note": ""
      }
    },
    {
      "id": "CLM-001-0015",
      "statement": "沈总认为复购下滑主要是会员老化；陈姐表示这是沈总的判断，她没有材料能证实，也补不出原因。",
      "kind": "opinion",
      "evidence_status": "reported",
      "qualifiers": [
        "原判断属于沈总，由陈姐转述",
        "陈姐本人没有材料能证实，也补不出原因"
      ],
      "evidence": [
        {
          "meeting_id": "6c1d37b4-9a0c-5106-8e00-9852640f4ea4",
          "message_id": "MSG-02609",
          "quote": "沈总说下滑主要是会员老化，这是他的判断，我这边没有材料能证实，也补不出原因。"
        }
      ],
      "conflict_ids": [],
      "review": {
        "status": "pending",
        "note": ""
      }
    },
    {
      "id": "CLM-001-0016",
      "statement": "陈姐认为，门店做活动时人员配合、现场接待会员、顾客问题反馈这些工作需要有记录，否则门店出了力也体现不出来。",
      "kind": "opinion",
      "evidence_status": "reported",
      "qualifiers": [